{
  "$schema": "./schemas/template-verification-manifest.v1.schema.json",
  "schema_version": "template-verification-manifest/v1",
  "repository": "NextCommerceCo/campaign-cart-starter-templates",
  "visibility": "public",
  "evidence": {
    "sdk-0.4.34-2026-08-12": {
      "sdk_version": "0.4.34",
      "source": {
        "sha": "8efd350f6fca6719d7c9f50977b3f26c087e4e0f",
        "fingerprint": "git-index-sha256:99b0abbfaed4699c6203e7a2179091750adc1ac7515557601b0548ffc677a166"
      },
      "verified_at": "2026-08-12T06:12:06Z",
      "checks": [
        {
          "name": "lint-sdk",
          "status": "passed",
          "url": "https://github.com/NextCommerceCo/campaign-cart-starter-templates/actions/runs/31569116320/job/94027132521",
          "completed_at": "2026-08-12T06:12:06Z"
        }
      ]
    },
    "sdk-0.4.36-2026-08-18": {
      "sdk_version": "0.4.36",
      "source": {
        "sha": "39c5a8edbb8e77d9f2356c66461961f72dc74f08",
        "fingerprint": "git-index-sha256:f1510ad66e0490efa5dc122e196a9f3d282f8633773f128849abcae0f55680ea"
      },
      "verified_at": "2026-08-18T17:14:06Z",
      "checks": [
        {
          "name": "lint-sdk",
          "status": "passed",
          "url": "https://github.com/NextCommerceCo/campaign-cart-starter-templates/actions/runs/32164481681",
          "completed_at": "2026-08-18T17:14:06Z"
        }
      ]
    },
    "sdk-0.4.37-2026-08-18": {
      "sdk_version": "0.4.37",
      "source": {
        "sha": "d2bf30ad02fd2c2a00730f181db9fe2e199c92a2",
        "fingerprint": "git-index-sha256:0c30e93bb13502c8a76c345ce0d6b5080d598cb44da26441a14bf10b7d48e496"
      },
      "verified_at": "2026-08-18T18:22:38Z",
      "checks": [
        {
          "name": "lint-sdk",
          "status": "passed",
          "url": "https://github.com/NextCommerceCo/campaign-cart-starter-templates/actions/runs/32170629812",
          "completed_at": "2026-08-18T18:22:38Z"
        }
      ]
    },
    "sdk-0.4.37-2026-08-18.2": {
      "sdk_version": "0.4.37",
      "source": {
        "sha": "1b50fd13437abc3f6eb81c40181860db01a2a4a1",
        "fingerprint": "git-index-sha256:17cfbd19a286226824aacf01a2ba8c5c628605252555b6f7d177730f2460ec3d"
      },
      "verified_at": "2026-08-18T19:01:26Z",
      "checks": [
        {
          "name": "lint-sdk",
          "status": "passed",
          "url": "https://github.com/NextCommerceCo/campaign-cart-starter-templates/actions/runs/32174247387",
          "completed_at": "2026-08-18T19:01:26Z"
        }
      ]
    },
    "sdk-0.4.37-2026-08-21": {
      "sdk_version": "0.4.37",
      "source": {
        "sha": "53767fe6042bafcfb9ca636054613fabcbe25746",
        "fingerprint": "git-index-sha256:4af543f207fcf01ea192db208a52dbd3c957af0e6113438d4f4eb4e40b285bed"
      },
      "verified_at": "2026-08-21T15:26:00Z",
      "checks": [
        {
          "name": "lint-sdk",
          "status": "passed",
          "url": "https://github.com/NextCommerceCo/campaign-cart-starter-templates/actions/runs/32497527266",
          "completed_at": "2026-08-21T15:26:00Z"
        }
      ]
    },
    "sdk-0.4.37-2026-08-24": {
      "sdk_version": "0.4.37",
      "source": {
        "sha": "a7cc8beaf9d332c5d8e501d36fb9d4d7e3667468",
        "fingerprint": "git-index-sha256:a0af4f10d91304b6a849e387ef05457834c07ce646d40412ff7f6ae604a89e08"
      },
      "verified_at": "2026-08-24T16:29:45Z",
      "checks": [
        {
          "name": "lint-sdk",
          "status": "passed",
          "url": "https://github.com/NextCommerceCo/campaign-cart-starter-templates/actions/runs/32751119556",
          "completed_at": "2026-08-24T16:29:45Z"
        }
      ]
    },
    "sdk-0.4.38-2026-08-27": {
      "sdk_version": "0.4.38",
      "source": {
        "sha": "eddcde8def894f24578d479ec53d28b4718d51cb",
        "fingerprint": "git-index-sha256:df5c578965e7fed5851220dbae3a5385cdabe6ba40a341a3c01da2135ca9fdd5"
      },
      "verified_at": "2026-08-27T19:50:47Z",
      "checks": [
        {
          "name": "lint-sdk",
          "status": "passed",
          "url": "https://github.com/NextCommerceCo/campaign-cart-starter-templates/actions/runs/33110379287",
          "completed_at": "2026-08-27T19:50:47Z"
        }
      ]
    },
    "sdk-0.4.38-2026-08-31": {
      "sdk_version": "0.4.38",
      "source": {
        "sha": "5e661bfcbf16c0d580337d1c033ce00720bb5c92",
        "fingerprint": "git-index-sha256:823d14f67b3b2b0b0ae5d8715c7a46ee6c15fd92629dd8205ebe42b8bf9dc3d4"
      },
      "verified_at": "2026-08-31T15:01:15Z",
      "checks": [
        {
          "name": "lint-sdk",
          "status": "passed",
          "url": "https://github.com/NextCommerceCo/campaign-cart-starter-templates/actions/runs/33405981923",
          "completed_at": "2026-08-31T15:01:15Z"
        }
      ]
    },
    "sdk-0.4.38-2026-08-31.2": {
      "sdk_version": "0.4.38",
      "source": {
        "sha": "6a0c96e724d27020ee410bd98704ec3f74f58b97",
        "fingerprint": "git-index-sha256:b7ee380a6d437f424c702145aa822d8d3590f364ab035124eb8d4dc0e83c322e"
      },
      "verified_at": "2026-08-31T17:35:29Z",
      "checks": [
        {
          "name": "lint-sdk",
          "status": "passed",
          "url": "https://github.com/NextCommerceCo/campaign-cart-starter-templates/actions/runs/33420362205",
          "completed_at": "2026-08-31T17:35:29Z"
        }
      ]
    },
    "sdk-0.4.38-2026-08-31.3": {
      "sdk_version": "0.4.38",
      "source": {
        "sha": "f48936aa0a9f3f7f3e92eddbdf7cbb2428d1806e",
        "fingerprint": "git-index-sha256:d91a206e29bcc7c47efff0fc7d03eebb7c725d64d81bd2a34bc832fd779e770f"
      },
      "verified_at": "2026-08-31T18:15:37Z",
      "checks": [
        {
          "name": "lint-sdk",
          "status": "passed",
          "url": "https://github.com/NextCommerceCo/campaign-cart-starter-templates/actions/runs/33423984863",
          "completed_at": "2026-08-31T18:15:37Z"
        }
      ]
    },
    "sdk-0.4.38-2026-08-31.4": {
      "sdk_version": "0.4.38",
      "source": {
        "sha": "5312e9459c041857c32a92116ce903a8085480f4",
        "fingerprint": "git-index-sha256:f22ae6a8f30a46c5ec6f835bd03ff33020acfa0e1035e6fdac013c361e8c4dc7"
      },
      "verified_at": "2026-08-31T22:26:45Z",
      "checks": [
        {
          "name": "lint-sdk",
          "status": "passed",
          "url": "https://github.com/NextCommerceCo/campaign-cart-starter-templates/actions/runs/33446208541",
          "completed_at": "2026-08-31T22:26:45Z"
        }
      ]
    },
    "sdk-0.4.38-2026-09-01": {
      "sdk_version": "0.4.38",
      "source": {
        "sha": "af7d58fefdc39a129deed63dbeb751d239baac8b",
        "fingerprint": "git-index-sha256:8c0bcd6cbc531489469ac6ac95cbb4457fb6a95dbe5bc9505c02a5969d5ff68d"
      },
      "verified_at": "2026-09-01T01:31:09Z",
      "checks": [
        {
          "name": "lint-sdk",
          "status": "passed",
          "url": "https://github.com/NextCommerceCo/campaign-cart-starter-templates/actions/runs/33459023703",
          "completed_at": "2026-09-01T01:31:09Z"
        }
      ]
    },
    "sdk-0.4.38-2026-09-03": {
      "sdk_version": "0.4.38",
      "source": {
        "sha": "c0acbf41bbb264a0154d449f4efa3974986645ec",
        "fingerprint": "git-index-sha256:551042914faf11d918dc9afe92888398199e73efc0e3b0d4a72802257a32894a"
      },
      "verified_at": "2026-09-03T17:42:57Z",
      "checks": [
        {
          "name": "lint-sdk",
          "status": "passed",
          "url": "https://github.com/NextCommerceCo/campaign-cart-starter-templates/actions/runs/33786144798",
          "completed_at": "2026-09-03T17:42:57Z"
        }
      ]
    },
    "sdk-0.4.38-2026-09-03.2": {
      "sdk_version": "0.4.38",
      "source": {
        "sha": "68f0bd3782377e94c536815c6de7731618fb59a9",
        "fingerprint": "git-index-sha256:f4049452b170fe72595d3fe8a5d5ed16496ffd7d57460d39e414aa8e9fd5c0e4"
      },
      "verified_at": "2026-09-03T17:58:38Z",
      "checks": [
        {
          "name": "lint-sdk",
          "status": "passed",
          "url": "https://github.com/NextCommerceCo/campaign-cart-starter-templates/actions/runs/33787710431",
          "completed_at": "2026-09-03T17:58:38Z"
        }
      ]
    },
    "sdk-0.4.38-2026-09-04": {
      "sdk_version": "0.4.38",
      "source": {
        "sha": "6d9f3d058f922b631ee6c14aff015d641200c5a2",
        "fingerprint": "git-index-sha256:729cce9c967f63f183a16bbe2938294f3390d2e1c47ffcbf84d005a5a2c4e5c9"
      },
      "verified_at": "2026-09-04T15:38:57Z",
      "checks": [
        {
          "name": "lint-sdk",
          "status": "passed",
          "url": "https://github.com/NextCommerceCo/campaign-cart-starter-templates/actions/runs/33890648153",
          "completed_at": "2026-09-04T15:38:57Z"
        }
      ]
    },
    "sdk-0.4.38-2026-09-09": {
      "sdk_version": "0.4.38",
      "source": {
        "sha": "d4061a23f953206dffe85e669e99974d1a6ceb0c",
        "fingerprint": "git-index-sha256:975d4c3a645a1bf4c2e8f95c559e3ed502aaf16e5b2cbadf82a47960741081b5"
      },
      "verified_at": "2026-09-09T19:36:29Z",
      "checks": [
        {
          "name": "lint-sdk",
          "status": "passed",
          "url": "https://github.com/NextCommerceCo/campaign-cart-starter-templates/actions/runs/34396031206",
          "completed_at": "2026-09-09T19:36:29Z"
        }
      ]
    },
    "sdk-0.4.38-2026-09-09.2": {
      "sdk_version": "0.4.38",
      "source": {
        "sha": "22abf67707d10e19cd61862b325b30dc86206783",
        "fingerprint": "git-index-sha256:3720b218e354919cfff6f11ddd12d0c9fea8419e9d910294d39a260b43ddec3b"
      },
      "verified_at": "2026-09-09T20:21:34Z",
      "checks": [
        {
          "name": "lint-sdk",
          "status": "passed",
          "url": "https://github.com/NextCommerceCo/campaign-cart-starter-templates/actions/runs/34400505576",
          "completed_at": "2026-09-09T20:21:34Z"
        }